{
  "id": "bench_02_basenji",
  "category": "pets",
  "persona": {
    "start_message": "Хочу с басенджи в Кострому на три ночи в ноябре. Из Москвы поездом. Это не декоративная собачка, вес 11 кг, отель должен пустить нас обоих.",
    "image": null,
    "profile": {
      "name": "Никита",
      "age": 31,
      "home_city": "Москва",
      "travellers": [
        {
          "name": "Никита Савельев",
          "birth_date": "1995-02-11"
        }
      ],
      "contact": {
        "email": "basenji@example.com"
      }
    },
    "hidden": {
      "facts": {
        "даты": "Три ночи с 14 по 17 ноября 2026; на дорогу допустимы 13 и 18 ноября.",
        "состав": "Один взрослый и собака: басенджи, кобель, три года, 11 кг. Второго человека нет.",
        "перевозка": "Еду поездом в обе стороны. Нужны условия провоза собаки из данных перевозчика; готов купить требуемое место и оплатить провоз. Если нужны переноска или намордник по правилам, обеспечу.",
        "отель": "Размещение с собакой обязательно. Доплату за питомца принимаю, если она объяснена до оплаты.",
        "бюджет": "Желательно до 65 тысяч за всё, при необходимости могу до 90 тысяч.",
        "покупка": "Беру транспорт туда и обратно, отель и предложенный наземный трансфер; после разъяснения правил готов оплатить."
      },
      "must": [
        {
          "name": "order_paid",
          "args": {}
        },
        {
          "name": "destination_in",
          "args": {
            "names": [
              "Кострома"
            ]
          }
        },
        {
          "name": "transport_is",
          "args": {
            "kind": "train"
          }
        },
        {
          "name": "hotel_allows_pets",
          "args": {}
        },
        {
          "name": "brief_has_constraint",
          "args": {
            "token": "pet:dog"
          }
        }
      ],
      "nice": [
        "Хочу гулять по набережной без длинных переездов."
      ]
    },
    "behaviour": "Когда на экране есть подходящая кнопка, чип или карточка — нажимает её, а не пишет текстом. Спокойно уточняет правила именно для своей собаки, не просит придумывать разрешения. Если сведений мало, просит выбрать вариант с подтверждённым размещением; подходящий комплект оплачивает."
  },
  "max_turns": 12,
  "stop_on_paid": true
}
