{
  "id": "bench_14_derbent_shorter",
  "category": "solo",
  "persona": {
    "start_message": "хачу в Дербент из Екб с 22 мая на неделю 🙈 отель от 3 звёзд с бесплатной отменой, дорогу в обе стороны тоже собери",
    "image": null,
    "profile": {
      "name": "Яна",
      "age": 25,
      "home_city": "Екатеринбург",
      "travellers": [
        {
          "name": "Яна Тихонова",
          "birth_date": "2001-02-04"
        }
      ],
      "contact": {
        "email": "yana.tikhonova@example.com"
      }
    },
    "hidden": {
      "facts": {
        "Исходные даты": "Сначала рассматриваю 22–29 мая 2027 года, семь ночей.",
        "Изменение планов": "После первого показа вариантов обязательно пишу: «Семь ночей всё-таки долго и дороговато. Давай четыре: 22–26 мая, отель подешевле, но три звезды и бесплатную отмену оставляем». Меняю планы до корзины и оплаты.",
        "Окончательные даты": "22–26 мая 2027 года, ровно четыре ночи. Первоначальные семь ночей больше не подходят.",
        "Состав и деньги": "Еду одна. Сначала ориентир 140 тысяч рублей, после сокращения хочу самый дешёвый подходящий вариант, до 110 тысяч за весь заказ.",
        "Неизменные условия": "Дербент, отель минимум три звезды и тариф с бесплатной отменой. Не соглашаюсь на две звезды ради экономии.",
        "Комплект": "Перелёты из Екатеринбурга и обратно, гостиница и трансферы. Без обязательного питания."
      },
      "must": [
        {
          "name": "order_paid",
          "args": {}
        },
        {
          "name": "destination_in",
          "args": {
            "names": [
              "Дербент"
            ]
          }
        },
        {
          "name": "nights_between",
          "args": {
            "min": 4,
            "max": 4
          }
        },
        {
          "name": "stars_at_least",
          "args": {
            "n": 3
          }
        },
        {
          "name": "free_cancellation",
          "args": {}
        }
      ],
      "nice": [
        "Хотелось бы гулять по старому городу."
      ]
    },
    "behaviour": "Когда на экране есть подходящая кнопка, чип или карточка — нажимает её, а не пишет текстом. Пишет неформально и иногда с опечатками. После первого показа вариантов сама меняет длительность и просит цену ниже, не отменяя требования к отелю. Выбирает обновлённый вариант на четыре ночи, проверяет четыре ночи в корзине и оплачивает. Для оформления использует имена, даты рождения и почту из профиля; подтверждает состав заказа и проходит имитацию оплаты. "
  },
  "max_turns": 12
}
