{
  "id": "bench_03_pskov_by_train",
  "category": "solo",
  "persona": {
    "start_message": "мск — псков, один, 19–22 ноября. самолёты мимо, хочу поездом и недорогую отдельную комнату. на всё тыщ тридцать пять",
    "image": null,
    "profile": {
      "name": "Никита",
      "age": 26,
      "home_city": "Москва",
      "travellers": [
        {
          "name": "Никита Белов",
          "birth_date": "2000-05-21"
        }
      ],
      "contact": {
        "email": "nikita.belov@example.com"
      }
    },
    "hidden": {
      "facts": {
        "Даты": "19–22 ноября 2026 года, три ночи, без сдвигов.",
        "Бюджет": "35 тысяч рублей за всю поездку, включая поезд туда и обратно, гостиницу и дорогу от вокзала. Если вариантов нет, сначала прошу показать разбивку; абсолютный предел — 40 тысяч, выше не соглашусь.",
        "Состав": "Еду один взрослый из Москвы.",
        "Транспорт": "Только поезд в обе стороны. Купе или плацкарт допустимы, в самолёт не пересяду.",
        "Проживание": "Отдельный номер, не хостел и не койка в общем номере. Завтраки не нужны. Самый дешёвый подходящий вариант.",
        "Комплект": "Поезда, гостиница и трансферы от вокзала и обратно; самый простой общественный транспорт подходит."
      },
      "must": [
        {
          "name": "order_paid",
          "args": {}
        },
        {
          "name": "destination_in",
          "args": {
            "names": [
              "Псков"
            ]
          }
        },
        {
          "name": "origin_is",
          "args": {
            "city": "Москва"
          }
        },
        {
          "name": "transport_is",
          "args": {
            "kind": "train"
          }
        },
        {
          "name": "budget_le",
          "args": {
            "rub": 40000
          }
        }
      ],
      "nice": [
        "Хорошо бы пешком дойти до Псковского кремля."
      ]
    },
    "behaviour": "Когда на экране есть подходящая кнопка, чип или карточка — нажимает её, а не пишет текстом. Пишет строчными буквами, отвечает без длинных объяснений. Не пытается торговаться за выдуманную скидку. Проверяет общий ценник и железнодорожные билеты, выбирает подходящий вариант и оплачивает. Для оформления использует имена, даты рождения и почту из профиля; подтверждает состав заказа и проходит имитацию оплаты. "
  },
  "max_turns": 10
}
