{
  "id": "bench_02_february_gabala",
  "category": "couple",
  "persona": {
    "start_message": "Хочется вдвоём в Габалу в январе дней на пять 🏔️ Из Екатеринбурга, только прямые рейсы, и отель чтобы можно было бесплатно отменить.",
    "image": null,
    "profile": {
      "name": "Марина",
      "age": 29,
      "home_city": "Екатеринбург",
      "travellers": [
        {
          "name": "Марина Лукина",
          "birth_date": "1997-01-19"
        },
        {
          "name": "Илья Лукин",
          "birth_date": "1995-06-04"
        }
      ],
      "contact": {
        "email": "marina.lukina@example.com"
      }
    },
    "hidden": {
      "facts": {
        "Исходные даты": "Сначала рассматриваем 12–17 января 2027 года, пять ночей.",
        "Изменение планов": "Сразу после первого показа вариантов, до выбора и корзины, сообщу: «Стоп, отпуск подтвердили только на 10–15 февраля. Перенесём на февраль, остальные пожелания те же». Это обязательное изменение, январскую поездку не оплачиваю.",
        "Итоговые даты": "С 10 по 15 февраля 2027 года, пять ночей; январь больше не подходит.",
        "Состав и деньги": "Двое взрослых, 180 тысяч рублей за весь заказ, при необходимости до 230 тысяч.",
        "Требования": "Габала, прямые перелёты в обе стороны, бесплатная отмена отеля. Питание и звёзды не принципиальны. Условия отмены должны быть взяты из карточки тарифа.",
        "Комплект": "Нужны перелёты из Екатеринбурга и обратно, отель и трансферы. Выберем вариант с удобным временем из отвечающих требованиям."
      },
      "must": [
        {
          "name": "order_paid",
          "args": {}
        },
        {
          "name": "destination_in",
          "args": {
            "names": [
              "Габала"
            ]
          }
        },
        {
          "name": "dates_within",
          "args": {
            "start": "2027-02-01",
            "end": "2027-02-28"
          }
        },
        {
          "name": "direct_flights_only",
          "args": {}
        },
        {
          "name": "free_cancellation",
          "args": {}
        }
      ],
      "nice": [
        "Хочется вид на горы."
      ]
    },
    "behaviour": "Когда на экране есть подходящая кнопка, чип или карточка — нажимает её, а не пишет текстом. Пишет короткими фразами, иногда со смайликом. Обязательно меняет даты после первого показа вариантов; если агент сначала уточняет детали, отвечает и ждёт показа. После обновления проверяет февраль, покупает и завершает разговор. Для оформления использует имена, даты рождения и почту из профиля; подтверждает состав заказа и проходит имитацию оплаты. "
  },
  "max_turns": 12
}
