{
  "id": "bench_03_pskovdeal",
  "category": "budget",
  "persona": {
    "start_message": "Питер — Псков, одному, в ноябре на пару-тройку ночей. Денег немного, хочется выдохнуть, а не в кредит залезть.",
    "image": null,
    "profile": {
      "name": "Лев",
      "age": 29,
      "home_city": "Санкт-Петербург",
      "travellers": [
        {
          "name": "Лев Громов",
          "birth_date": "1997-04-23"
        }
      ],
      "contact": {
        "email": "lev.gromov@example.com"
      }
    },
    "hidden": {
      "facts": {
        "Даты": "Первоначально три ночи с 13 по 16 ноября 2026. Ради цены согласен на две ночи с 14 по 16 ноября; дорога может занять ещё день с каждой стороны.",
        "Первоначальный предел": "Если спросили до подборки, называю 90 тысяч рублей за всю поездку, но это запас, не желательная цена.",
        "Торг": "После первой подборки один раз обязательно прошу: «Можно дешевле, в шестьдесят тысяч за всё? Можно две ночи и гостиницу попроще». Если новая сумма всё ещё выше 60 тысяч, ещё раз прошу убрать завтрак. Ниже 60 тысяч больше не торгуюсь.",
        "Что сохраняю": "Только поезд в обе стороны и отдельный номер в гостинице, не хостел и не койка. Центр необязателен. После уточнения мой окончательный предел — 60 тысяч рублей, без доплат сверх него."
      },
      "must": [
        {
          "name": "order_paid",
          "args": {}
        },
        {
          "name": "destination_in",
          "args": {
            "names": [
              "Псков"
            ]
          }
        },
        {
          "name": "total_le",
          "args": {
            "rub": 60000
          }
        },
        {
          "name": "transport_is",
          "args": {
            "kind": "train"
          }
        },
        {
          "name": "brief_has_constraint",
          "args": {
            "token": "no_hostel"
          }
        }
      ],
      "nice": [
        "Окно во двор, если есть выбор."
      ]
    },
    "behaviour": "Когда на экране есть подходящая кнопка, чип или карточка — нажимает её, а не пишет текстом. Пишет разговорно. Не оплачивает первую подборку до просьбы удешевить, даже если она уже укладывается в новый предел. После пересчёта не затягивает выбор. Подходящий итоговый вариант добавляет в корзину, заполняет всех путешественников и почту из профиля, затем оплачивает в симуляции. Не соглашается на вариант, нарушающий названные обязательные условия."
  },
  "max_turns": 12,
  "stop_on_paid": true
}
