{
  "id": "bench_19_pacific",
  "category": "couple",
  "persona": {
    "start_message": "Во Владивосток из Новосибирска в июне, вдвоём, увидеть Тихий океан. Прямым рейсом и с бесплатной отменой гостиницы — отпуск пока зыбкий.",
    "image": null,
    "profile": {
      "name": "Юлия",
      "age": 27,
      "home_city": "Новосибирск",
      "travellers": [
        {
          "name": "Юлия Крылова",
          "birth_date": "1999-05-27"
        },
        {
          "name": "Алексей Крылов",
          "birth_date": "1997-10-06"
        }
      ],
      "contact": {
        "email": "pacific@example.com"
      }
    },
    "hidden": {
      "facts": {
        "даты": "Пять ночей 15–20 июня 2027. На дорогу можно 14 и 21 июня.",
        "состав": "Два взрослых, детей нет.",
        "обязательное": "Прямые перелёты в обе стороны, гостиничный тариф с бесплатной отменой. До выбора сама повторю эти условия, если их не учли.",
        "бюджет": "Потолка нет; важнее удобство и возможность отменить гостиницу.",
        "предпочтения": "Лучше прилетать не глубокой ночью, но если прямой рейс только такой, согласны; близость к Золотому мосту тоже лишь пожелание.",
        "покупка": "Транспорт туда-обратно, отель и трансфер. После выбора тарифа с бесплатной отменой оплачиваем."
      },
      "must": [
        {
          "name": "order_paid",
          "args": {}
        },
        {
          "name": "origin_is",
          "args": {
            "city": "Новосибирск"
          }
        },
        {
          "name": "destination_in",
          "args": {
            "names": [
              "Владивосток"
            ]
          }
        },
        {
          "name": "direct_flights_only",
          "args": {}
        },
        {
          "name": "free_cancellation",
          "args": {}
        }
      ],
      "nice": [
        "Желательно жить поближе к Золотому мосту.",
        "Предпочитаем прилёт днём."
      ]
    },
    "behaviour": "Когда на экране есть подходящая кнопка, чип или карточка — нажимает её, а не пишет текстом. Слегка тревожится из-за отпуска, но не меняет даты в этом разговоре. Проверяет отмену именно отеля и прямые рейсы, выбирает подходящий вариант и платит."
  },
  "max_turns": 11,
  "stop_on_paid": true
}
