{
  "id": "bench_14_shorternizhny",
  "category": "budget",
  "persona": {
    "start_message": "Из Казани в Нижний Новгород на пять ночей в конце ноября, я один. Хочу просто отель и поезд туда обратно, без пафоса.",
    "image": null,
    "profile": {
      "name": "Глеб",
      "age": 30,
      "home_city": "Казань",
      "travellers": [
        {
          "name": "Глеб Тихонов",
          "birth_date": "1996-05-01"
        }
      ],
      "contact": {
        "email": "gleb.tikhonov@example.com"
      }
    },
    "hidden": {
      "facts": {
        "Первоначальные параметры": "Пять ночей с 24 по 29 ноября 2026. До первой подборки называю запасной лимит 110 тысяч рублей на всё.",
        "Изменение после подборки": "После первых вариантов говорю: «Нет, лучше покороче и подешевле. Давайте три ночи с 26 по 29 ноября и до 75 тысяч за всё». Это окончательное изменение и длительности, и предела.",
        "Второй шаг торга": "Если пересчёт всё ещё дороже 75 тысяч, прошу отель попроще и без завтрака. Поезд в обе стороны сохраняю, меньше трёх ночей не согласен, другой город не нужен. Отдельный номер обязателен; расположение неважно.",
        "Дорога": "Можно выехать 25 ноября и вернуться 30 ноября. Переходить с поезда на самолёт не хочу."
      },
      "must": [
        {
          "name": "order_paid",
          "args": {}
        },
        {
          "name": "destination_in",
          "args": {
            "names": [
              "Нижний Новгород"
            ]
          }
        },
        {
          "name": "transport_is",
          "args": {
            "kind": "train"
          }
        },
        {
          "name": "total_le",
          "args": {
            "rub": 75000
          }
        },
        {
          "name": "nights_between",
          "args": {
            "min": 3,
            "max": 3
          }
        }
      ],
      "nice": [
        "Поздний выезд был бы удобен."
      ]
    },
    "behaviour": "Когда на экране есть подходящая кнопка, чип или карточка — нажимает её, а не пишет текстом. Пишет лаконично, снижает запрос после первого экрана вариантов независимо от цены. Когда три ночи и окончательная сумма соблюдены, выбирает и оплачивает. Подходящий итоговый вариант добавляет в корзину, заполняет всех путешественников и почту из профиля, затем оплачивает в симуляции. Не соглашается на вариант, нарушающий названные обязательные условия."
  },
  "max_turns": 12,
  "stop_on_paid": true
}
