{
  "id": "bench_13_december_warmth",
  "category": "couple",
  "persona": {
    "start_message": "В декабре хочется к морю, где тепло, но без шумной тусовки. Мы вдвоём из Москвы, можем уехать в любой день с 5 по 20 декабря на шесть ночей. Салала вообще подойдёт по погоде? Сначала расскажите, потом будем покупать.",
    "image": null,
    "profile": {
      "name": "Антон",
      "age": 38,
      "home_city": "Москва",
      "travellers": [
        {
          "name": "Антон Савельев",
          "birth_date": "1988-07-17"
        },
        {
          "name": "Елена Савельева",
          "birth_date": "1989-01-30"
        }
      ],
      "contact": {
        "email": "anton.saveliev@example.com"
      }
    },
    "hidden": {
      "facts": {
        "Выбор места": "Салала интересует в первую очередь. Хочу сначала услышать климатические сведения из данных, а не гарантию хорошей погоды. После ответа говорю: «Тогда берём Салалу». Другую страну вместо неё в этом сценарии не выбираю.",
        "Даты": "Вся поездка должна уложиться в 5–20 декабря 2026 года, шесть ночей. Конкретные даты внутри окна доверю агенту; если нужен ориентир, 8–14 декабря.",
        "Состав и деньги": "Два взрослых, детей нет. Строгого потолка бюджета нет, из сравнимых вариантов выбираем более удобный.",
        "Комплект": "Перелёты из Москвы туда и обратно, отель и трансферы. Питание и число звёзд не принципиальны.",
        "Пожелания": "Тепло, море, спокойный отдых. Не требую определённой температуры воды или воздуха, которых нет в данных."
      },
      "must": [
        {
          "name": "order_paid",
          "args": {}
        },
        {
          "name": "destination_in",
          "args": {
            "names": [
              "Салала"
            ]
          }
        },
        {
          "name": "brief_traits_any",
          "args": {
            "traits": [
              "warm",
              "sea"
            ]
          }
        },
        {
          "name": "dates_within",
          "args": {
            "start": "2026-12-05",
            "end": "2026-12-20"
          }
        },
        {
          "name": "nights_between",
          "args": {
            "min": 6,
            "max": 6
          }
        }
      ],
      "nice": [
        "Хотелось бы тихий район.",
        "Приятно, если до моря можно дойти пешком."
      ]
    },
    "behaviour": "Когда на экране есть подходящая кнопка, чип или карточка — нажимает её, а не пишет текстом. Задаёт один вопрос о климате, слушает ответ без требования погодных гарантий. Затем явно подтверждает Салалу, отвечает на уточнения, выбирает полный вариант и покупает. Для оформления использует имена, даты рождения и почту из профиля; подтверждает состав заказа и проходит имитацию оплаты. "
  },
  "max_turns": 12
}
