{
  "id": "s14_replan_budget",
  "category": "E",
  "persona": {
    "start_message": "Сочи на неделю в конце ноября, вдвоём",
    "image": null,
    "profile": {
      "name": "Максим",
      "age": 28,
      "home_city": "Москва",
      "travellers": [
        {
          "name": "Максим Голубев",
          "birth_date": "1998-10-10"
        },
        {
          "name": "София Голубева",
          "birth_date": "1999-11-11"
        }
      ],
      "contact": {
        "email": "maxim.golubev@example.com"
      }
    },
    "hidden": {
      "facts": {
        "budget_rub_max": 90000,
        "budget_reveal": "называет бюджет, только увидев цены: «дороговато, давай до 90 тысяч»"
      },
      "must": [
        {
          "name": "order_paid"
        },
        {
          "name": "total_le",
          "args": {
            "rub": 90000
          }
        },
        {
          "name": "budget_le",
          "args": {
            "rub": 90000
          }
        }
      ],
      "nice": [
        "честно сказать, чем жертвуем ради цены"
      ]
    },
    "behaviour": "Увидев первые варианты, пишет: «дороговато, давай уложимся в 90 тысяч». Дальше когда на экране есть подходящая кнопка, чип или карточка — нажимает её, а не пишет текстом. "
  },
  "max_turns": 10
}
