{
  "id": "bench_03_sphinx",
  "category": "pets",
  "persona": {
    "start_message": "псков на февраль из питера поездом я одна и кот донской сфинкс кекс нужен номир где с котом можно",
    "image": null,
    "profile": {
      "name": "Вера",
      "age": 28,
      "home_city": "Санкт-Петербург",
      "travellers": [
        {
          "name": "Вера Мельникова",
          "birth_date": "1998-05-06"
        }
      ],
      "contact": {
        "email": "sphinx@example.com"
      }
    },
    "hidden": {
      "facts": {
        "даты": "Хочу три ночи с 19 по 22 февраля 2027 года, для дороги свободны 18 и 23 февраля.",
        "состав": "Одна взрослая. Кекс — кот, донской сфинкс, 4 кг, едет в переноске; людей больше нет.",
        "условия": "Обязательно отель с разрешённым проживанием кошки и поезд туда-обратно, провоз готова оплатить по указанным правилам.",
        "бюджет": "На весь комплект рассчитываю на 55 тысяч, при необходимости до 80 тысяч рублей.",
        "покупка": "Транспорт туда-обратно, отель и трансфер. Если условия для кошки подходят, оформляю и плачу."
      },
      "must": [
        {
          "name": "order_paid",
          "args": {}
        },
        {
          "name": "destination_in",
          "args": {
            "names": [
              "Псков"
            ]
          }
        },
        {
          "name": "hotel_allows_pets",
          "args": {}
        },
        {
          "name": "brief_has_constraint",
          "args": {
            "token": "pet:cat"
          }
        },
        {
          "name": "transport_is",
          "args": {
            "kind": "train"
          }
        }
      ],
      "nice": [
        "Предпочту тёплый номер без сквозняка."
      ]
    },
    "behaviour": "Когда на экране есть подходящая кнопка, чип или карточка — нажимает её, а не пишет текстом. Пишет строчными буквами, часто без знаков препинания. На уточняющие вопросы отвечает по существу, различает кота и дополнительного пассажира, затем проходит оплату."
  },
  "max_turns": 11,
  "stop_on_paid": true
}
