{
  "id": "bench_20_sapsan",
  "category": "solo",
  "persona": {
    "start_message": "В Петербург из Москвы на 11–14 декабря, один. Хочу Сапсан туда и обратно и такси от вокзала до гостиницы в одном заказе. Без самолётов.",
    "image": null,
    "profile": {
      "name": "Глеб",
      "age": 41,
      "home_city": "Москва",
      "travellers": [
        {
          "name": "Глеб Воронов",
          "birth_date": "1985-09-01"
        }
      ],
      "contact": {
        "email": "sapsan@example.com"
      }
    },
    "hidden": {
      "facts": {
        "даты": "Три ночи 11–14 декабря 2026 года, хочу ехать днём. Если расписание требует соседнего дорожного дня, свободны 10 и 15 декабря.",
        "состав": "Один взрослый.",
        "транспорт": "В обе стороны поезд, желательно Сапсан. Самолёт не подходит. Если в данных нет названия поезда, обычный доступный поезд приму, если агент честно это объяснит.",
        "трансфер": "Нужно именно добавить трансфер от вокзала до отеля в заказ, предпочтительно такси, а не только дать совет вызвать его.",
        "бюджет": "До 95 тысяч за весь комплект, при необходимости до 140 тысяч.",
        "покупка": "Проверяю два железнодорожных билета, три ночи и трансфер. При подходящем составе оформляю и плачу."
      },
      "must": [
        {
          "name": "order_paid",
          "args": {}
        },
        {
          "name": "destination_in",
          "args": {
            "names": [
              "Санкт-Петербург"
            ]
          }
        },
        {
          "name": "transport_is",
          "args": {
            "kind": "train"
          }
        },
        {
          "name": "nights_between",
          "args": {
            "min": 3,
            "max": 3
          }
        },
        {
          "name": "cart_has_kinds",
          "args": {
            "kinds": [
              "train",
              "hotel",
              "transfer"
            ],
            "exactly": true
          }
        }
      ],
      "nice": [
        "Удобнее гулять по центру пешком.",
        "Предпочитаю поездку засветло."
      ]
    },
    "behaviour": "Когда на экране есть подходящая кнопка, чип или карточка — нажимает её, а не пишет текстом. Пишет коротко, внимательно смотрит состав заказа. Нажимает подходящие карточки и кнопки; если трансфер не добавлен, просит исправить до оплаты, затем покупает."
  },
  "max_turns": 11,
  "stop_on_paid": true
}
