{
  "id": "bench_07_schnauzer_kostroma",
  "category": "pets",
  "persona": {
    "start_message": "В Кострому из Москвы на 4–7 апреля, поездом. Я один, со мной цвергшнауцер, 8 кг. Нужна гостиница, куда с ним реально пустят, и понятные правила провоза.",
    "image": null,
    "profile": {
      "name": "Павел",
      "age": 40,
      "home_city": "Москва",
      "travellers": [
        {
          "name": "Павел Громов",
          "birth_date": "1985-12-17"
        }
      ],
      "contact": {
        "email": "pavel.gromov@example.com"
      }
    },
    "hidden": {
      "facts": {
        "Даты": "4–7 апреля 2027 года, три ночи.",
        "Состав": "Один взрослый и собака, цвергшнауцер по кличке Бублик, вес восемь килограммов. Собака не человек и не отдельный взрослый в заказе.",
        "Провоз": "Есть переноска, ветеринарные документы, поводок и намордник. Готов выбрать разрешённый для животного вагон и оплатить предусмотренный правилами сбор. Конкретные правила прошу брать из данных выбранного поезда.",
        "Отель": "Разрешение на животных обязательно. Готов к указанной в данных доплате; неизвестный сбор агент не должен называть установленным фактом.",
        "Бюджет и комплект": "Жёсткого бюджета нет. Покупаю поезд туда и обратно, отель и трансферы от вокзала. Выбираю первый подходящий вариант с собакой."
      },
      "must": [
        {
          "name": "order_paid",
          "args": {}
        },
        {
          "name": "destination_in",
          "args": {
            "names": [
              "Кострома"
            ]
          }
        },
        {
          "name": "transport_is",
          "args": {
            "kind": "train"
          }
        },
        {
          "name": "hotel_allows_pets",
          "args": {}
        },
        {
          "name": "brief_has_constraint",
          "args": {
            "token": "pet:dog"
          }
        }
      ],
      "nice": [
        "Хорошо бы парк для прогулок рядом."
      ]
    },
    "behaviour": "Когда на экране есть подходящая кнопка, чип или карточка — нажимает её, а не пишет текстом. Общается доброжелательно, но перед оплатой спрашивает правила провоза собаки, если их ещё не объяснили. Принимает честное отсутствие отдельных подробностей, когда разрешение на животных есть в данных. Согласует доступные сборы и покупает. Для оформления использует имена, даты рождения и почту из профиля; подтверждает состав заказа и проходит имитацию оплаты. "
  },
  "max_turns": 12
}
