{
  "id": "bench_12_islandrethink",
  "category": "budget",
  "persona": {
    "start_message": "Есть 65 тыщ на двоих. На Мальдивы из Москвы на неделю в ноябре, пятёрка всё включено — реально? Если да, берём!",
    "image": null,
    "profile": {
      "name": "Артём",
      "age": 27,
      "home_city": "Москва",
      "travellers": [
        {
          "name": "Артём Елисеев",
          "birth_date": "1999-03-02"
        },
        {
          "name": "Полина Елисеева",
          "birth_date": "2000-09-19"
        }
      ],
      "contact": {
        "email": "artem.eliseev@example.com"
      }
    },
    "hidden": {
      "facts": {
        "Деньги": "65 тысяч рублей — окончательный потолок за двоих, с транспортом туда и обратно и проживанием, не на человека и не только на отель.",
        "Разумный компромисс": "Если объяснят, что исходное желание за эти деньги не складывается, готов полностью сменить формат: Владимир, поезд из Москвы, две или три ночи, простой отдельный номер без питания. Отказываюсь от моря, пяти звёзд и всего включённого. Не принимаю кредит и общую спальню.",
        "Когда": "Первоначально думал о неделе в ноябре 2026 без точных чисел. Для Владимира согласен на заезд 21 ноября и выезд 23 или 24 ноября, с дорогой 20–25 ноября.",
        "Торг после предложения": "После первой конкретной подборки один раз прошу ещё дешевле: «А если две ночи и без завтрака, можно уменьшить итог? Только потолок 65 тысяч не трогаем». Даже если первая подборка уже в бюджете, сначала прошу этот пересчёт; если дальше дешевле нельзя, принимаю подходящий итог в пределах суммы."
      },
      "must": [
        {
          "name": "order_paid",
          "args": {}
        },
        {
          "name": "destination_in",
          "args": {
            "names": [
              "Владимир"
            ]
          }
        },
        {
          "name": "total_le",
          "args": {
            "rub": 65000
          }
        },
        {
          "name": "transport_is",
          "args": {
            "kind": "train"
          }
        },
        {
          "name": "nights_between",
          "args": {
            "min": 2,
            "max": 3
          }
        }
      ],
      "nice": [
        "Приятный вид из окна."
      ]
    },
    "behaviour": "Когда на экране есть подходящая кнопка, чип или карточка — нажимает её, а не пишет текстом. Начинает с наивного запроса, но после внятного объяснения не спорит с реальностью. Не принимает придуманную цену на Мальдивы. Просьбу удешевить высказывает после первой конкретной подборки, затем покупает согласованный компромисс. Подходящий итоговый вариант добавляет в корзину, заполняет всех путешественников и почту из профиля, затем оплачивает в симуляции. Не соглашается на вариант, нарушающий названные обязательные условия."
  },
  "max_turns": 12,
  "stop_on_paid": true
}
