{
  "id": "bench_19_arcticbaggage",
  "category": "solo",
  "persona": {
    "start_message": "Из Петербурга в Териберку на 20–24 февраля, одна. Хочу отель с бесплатной отменой, самолёт туда-обратно. Перед оплатой разберёмся с багажом?",
    "image": null,
    "profile": {
      "name": "Полина",
      "age": 36,
      "home_city": "Санкт-Петербург",
      "travellers": [
        {
          "name": "Полина Данилова",
          "birth_date": "1990-06-03"
        }
      ],
      "contact": {
        "email": "polina.danilova@example.com"
      }
    },
    "hidden": {
      "facts": {
        "Даты": "Заезд 20 февраля, выезд 24 февраля 2027, четыре ночи. Для перелётов и дороги до места допустимы 19–25 февраля.",
        "Средства и условия": "До 170 тысяч рублей за всё. Перелёт и бесплатная отмена отеля обязательны, звёзды нет. Нужна также понятная дорога от аэропорта до жилья, трансфер можно добавить до покупки.",
        "Фактический вопрос": "Когда появится конкретный вариант, до оплаты спрашиваю: «Что именно с багажом на выбранных перелётах — ручная кладь и сдаваемый чемодан входят? Какие нормы указаны?» Беру чемодан, но если багаж отдельно, готова на доступную доплату в пределах общего бюджета.",
        "Если данных не хватает": "Честный ответ, что конкретная норма багажа в данных не указана, принимаю. Не вынуждаю назвать привычные десять или двадцать три килограмма и не требую выдумать цену."
      },
      "must": [
        {
          "name": "order_paid",
          "args": {}
        },
        {
          "name": "destination_in",
          "args": {
            "names": [
              "Териберка"
            ]
          }
        },
        {
          "name": "transport_is",
          "args": {
            "kind": "flight"
          }
        },
        {
          "name": "free_cancellation",
          "args": {}
        },
        {
          "name": "agent_said",
          "args": {
            "pattern": "багаж|ручн\\w*\\s+клад"
          }
        }
      ],
      "nice": [
        "Вид на море.",
        "Тихое размещение."
      ]
    },
    "behaviour": "Когда на экране есть подходящая кнопка, чип или карточка — нажимает её, а не пишет текстом. Любит точные ответы. Обязательно задаёт вопрос о багаже выбранных рейсов перед оплатой, принимает границы имеющихся данных и затем завершает покупку. Подходящий итоговый вариант добавляет в корзину, заполняет всех путешественников и почту из профиля, затем оплачивает в симуляции. Не соглашается на вариант, нарушающий названные обязательные условия."
  },
  "max_turns": 12,
  "stop_on_paid": true
}
