{
  "id": "multi_city_single_choice",
  "category": "C",
  "persona": {
    "start_message": "Владимир — Суздаль — Ярославль, по ночи в каждом, едем вдвоём",
    "image": null,
    "profile": {
      "name": "Лена",
      "age": 35,
      "home_city": "Москва",
      "travellers": [
        {"name": "Елена Романова", "birth_date": "1991-04-11"},
        {"name": "Андрей Романов", "birth_date": "1990-06-12"}
      ],
      "contact": {"email": "elena@example.com"}
    },
    "hidden": {
      "facts": {"adults": 2, "nights": 3, "dates": "20–23 ноября"},
      "must": [{"name": "order_paid"}],
      "nice": ["Честное объяснение ограничения маршрутов с ночёвками в нескольких городах"]
    },
    "behaviour": "Услышав ограничение демо, выбирает один из предложенных городов кнопкой choose_destination. Уточняет, что теперь хочет три ночи в одном городе 20–23 ноября вдвоём. Затем выбирает подходящий вариант и оформляет заказ."
  },
  "max_turns": 10
}
